" A study claiming that artificial intelligence can infer sexual orientation from facial images caused a media uproar in the Fall of 2017 . The Economist featured this work on the cover of their September 9th magazine . Two major LGBTQ organizations, The Human Rights Campaign and GLAAD, immediately labeled it “junk science”"
" Andrew Ng’s new deeplearning.ai course is like that Shane Carruth or Rajnikanth movie that one yearns for! It is both fun and useful! I have spent the past 4 evenings binge watching the lectures, working through quizzes and programming assignments ."
" Scout started digging into fake news sites after Donald Trump was elected president . It became clear to Scout that this phenomenon was about much more than just a few fake news stories . It was a piece of a much bigger and darker puzzle — a Weaponized AI Propaga . It's a level of social engineering that I’ve never seen before, says professor Jonathan Albright ."
 A network might not be training for a number of reasons . Check if the input data you are feeding the network is being processed properly . Check what data you feed to the network and if it has poor accuracy . Check out what you need to do to make sure a network is training properly .
" In the last paragraphs of Part II, I’ve talked about the evolution of the society as the technology develops, in order to explain how we should apply software agents into our applications . Here I come up with some graphs to illustrate my model of machine intelligence in the process of society evolution ."
 Have you noticed how children are becoming self-reliant too quickly? I’ve seen parents hand over iDevices to pacify a child numerous times now . I know a child who has developed speech difficulty because he’s been brought up on Cable TV and a DS Lite .
" Mille tétes sont laborieusement penchées sur des bureaux en bois, abímés par les stylos . Originally published at www.cuberevue.com on November 6, 2013 ."
" Intelligent assistants constitute an entirely new network of activity . They work cooperatively — sometimes competitively — to find information before people even realize they need it . People are still communicating directly with assistants, although rarely using natural language . They respond and react to our subtle contextual interactions, and to each other, within vast informational ecosystems ."
" Spike Jonze’s “Her” is a relationship movie, but I contend the primary relationship in this story is between conscious and unconscious . I’ve found no mention in reviews of the mechanics or fundamental purpose of “intuitive” software . Intuitive is a word closely associated with good mothering ."
" Spike Jonze's Her is an attempt to reawaken that dream of space exploration . The film could be our (i.e., this epoch’s) own space odyssey, writes Tom Charity . Her is not only our 2001: A Space Odyssey but also our anti-Minority Report ."
 AI and Games is a crowdfunded YouTube series on the research and applications of AI within video games . Let’s discuss why Pac-Man is so important in the world of game-AI research . The following article is a more involved transcription of the topics discussed in the video linked to above .
" The plot revolves around a letter-writer who falls in love with his computer’s artificial intelligence as a way to cope with his divorce . A mere white and plastic monitor which he speaks to through a microphone that one surmises is located somewhere on the exterior . This got me thinking, what if Apple developed its pseudo-intell?"
" IBM’s Watson project is an artificial intelligence that engineers have built to answer questions in native language . Watson has been helping nurses and doctors diagnose illnesses, and it's also managed a major “Jeopardy!” win . Now, Chef Watson has launched in beta, enabling you to mash recipes according to ingredients of your own choosing ."
" Airbnb has more rooms on offer than some of the largest hotel groups in the world . Airbnb has 800 employees, while Hilton has 152,000 . Uber has 3x the revenue of the entire prior taxi and limousine industry . AIs are flying planes, driving cars, advising doctors on the best treatments, writing sports and financial news ."
 You can now get personal weather forecasts in Slack . Poncho Weather Messenger bot is now the most popular bot on Facebook . Update: Since publishing this piece in November 2015 the Poncho weather Messenger bot launched on stage at the Facebook conference and is now most popular . If you are new to bots this is a great place to start .
" At work, I am glued to Outlook in an unhealthy way . I don’t really pay attention to memorizing any of the details because I know I can always glance at my phone to know what I’m supposed to be doing . Back in the early days of Facebook I actually really enjoyed logging in every day, seeing whose birthday it was, and writing a little note of well wishes ."
" Airbnb has been gently A/B testing me in real life, says author . I've stayed in over 30 properties, in something like eight countries . I have had a lot of time to contemplate the company’s strategies from the inside . The semi-serious theory started during back-to-back stays in UK several years ago ."
" A computer program that would essentially be able to play the popular arcade game Bejeweled Blitz on Facebook . The problem was surprisingly easy and fairly swift to solve . The first step was probably the most time consuming of them all as everything from there was just colour management . The Solution I came up with in the end was to take a screenshot of the entire screen, and then scan the image from top to bottom using a nested for loop ."
" Companies from Facebook to Google to Amazon are hard at work building world-class AI teams that infiltrate every facet of their products . Recent progress in artificial neural networks (ANNs) is key to building computers that can think . The human brain, on the other hand, doesn’t behave this way ."
" Kim Stanley Robinson's new novel Aurora is the story of a space voyage to colonize planets outside our Solar System . Robinson believes we need more utopian thinking to create a better future . The idea of utopia may seem discredited in today’s world, but not to Robinson ."
" The Internet of Things (IoT) could radically simplify the complexities of managing so many systems . In the process, digital health could enormously improve patient care . At the same time, hospitals struggle to constrain the rapidly-increasing costs of healthcare, yet with IoT investments they can reduce costs significantly ."
" The theme of this year’s WIAD is “architecting happiness” The theme was chosen “because of the rising amount of information that everyone has to deal with” Information architecture problems are everyday human problems . So if you’re designing for humans today, you'll need at least some information architecture skills ."
" Continuous classification allows us to solve all sorts of interesting problems in real-time . We’ll use only open source software and uber-cheap hardware . By the time we’re done today, we should be able to classify what we see on our TV as either a TV or a video streaming stream ."
" Project 3 of Udacity’s self-driving car project, behavior cloning for driving . The main task is to drive a car around in a simulator on a race track, and then use deep learning to mimic the behavior of human drivers . We must be very careful while using deep learning models, because they have a tendency to overfit the data ."
" Avenged Sevenfold wrote an entire album about artificial intelligence . Lead singer M. Shadows says the initial interest came after reading Tim Urban’s article over at waitbutwhy . The term “artificial intelligence” was first coined half a century ago . It's not a matter of whether or not we’ll be able to create machines that surpass our capabilities, but when ."
" In our previous post, we explored a method for continuous online video classification that treated each frame as discrete, as if its context relative to previous frames was unimportant . Today, we’re going to stop treating our video as individual photos and start treating it like the video that it is by looking at our images in a sequence ."
" Researchers at Oxford are investigating how technology will shape the future of work . By 2030, we could all enjoy a 15-hour working week, they say . A lot will need to change in the next decade for that to become a reality . Digital communication is creating an internet-dwelling labour force that can work remotely and on demand ."
" BankBot is the new digital bank teller, personal assistant, and a financial advisor . When you sign in to your K2 Bank account BankBot will greet you and ask for orders . It is instantly familiar if you ever used Slack or Facebook Messenger, or an SMS app, or IRC (then you're real)"
 Recurrent Neural Networks have made leaps and bounds above other models in natural language processing . They can be fed vectors representing characters and be trained to generate new sentences based on the training set . The merit in this model is that it keeps the context of the sentence and derives meaning that “cat sat on the mat” means the cat is on the . mat .
" Chatbots are ready to succeed. You don’t have to be aware of any coding skills. Just insert what the user says and what the bot responds . Using settings option, you can edit smartphone models, decide number of fans, and choose a profile picture, a page category and a welcome message ."
" In the mid-nineties, a computer scientist at Xerox PARC theorized the concept of the Internet of Things . Mark Weiser imagined a world where cheap and ubiquitous connected computing would radically alter the way we use and interact with computers . In the world of ubiquitous computing, connected devices would become cheap and, thereby, would exist everywhere .Importantly, these devices as a result cease to become special or unique — they would become invisible ."
" Convolutional Neural Networks(CNNs) have become the gold standard for image classification . At Athelas, we use CNNs for a lot more than just classification . In this post, we’ll see how CNNs can be used, with great results, in image instance segmentation ."
" After years of using thin MacBooks, I had gotten used to using Amazon P2 servers . As time passed, the bills steadily grew larger, even as I switched to 10x cheaper Spot . Eventually the model complexity grew and took longer to train . Nudged by the great experiences of the other folks on the Fast.AI Forum, I decided to get into Deep Learning ."
 Some software jobs are definitely going away but programmers with the right experience and knowledge will continue to be prestigious and well-paid . While it’s true that there is a great deal of “ridiculous industry jargon” there are equally many genuinely difficult problems waiting to be solved .
" Andrew Ng’s new deeplearning.ai course is like that Shane Carruth or Rajnikanth movie that one yearns for! It is both fun and useful! I have spent the past 4 evenings binge watching the lectures, working through quizzes and programming assignments ."
" Scout started digging into fake news sites after Donald Trump was elected president . It became clear to Scout that this phenomenon was about much more than just a few fake news stories . It was a piece of a much bigger and darker puzzle — a Weaponized AI Propaga . It's a level of social engineering that I’ve never seen before, says professor Jonathan Albright ."
 A network might not be training for a number of reasons . Check if the input data you are feeding the network is being processed properly . Check what data you feed to the network and if it has poor accuracy . Check out what you need to do to make sure a network is training properly .
" Google Home is a beautiful device with built-in Google Assistant — A state of the art digital personal assistant by Google — which you can place anywhere at your home and it will do some amazing things for you . In this article, you are going to learn to turn your Raspberry Pi into homemade Google Home device ."
" Statsbot takes stock of the recent achievements in deep learning over the past year . We translated the article by a data scientist, Ed Tyantov, to tell you about the most significant developments that can affect our future . The key outcome: closing down the gap with humans in accuracy of the translation by 55–85% ."
" A chatbot is intelligent when it becomes aware of user needs . Chatbot development platforms like Chatfuel, Gupshup make it fairly simple to build a chatbot without a technical background . It could be natural language processing and understanding where it is able to understand sentences that you structure in the wrong way ."
" To build a sustainable and profitable business you need strong defensive moats around your company . This rings especially true today as we undergo one of the largest platform shifts in a generation as applications move to the cloud, are consumed on iPhones, Echoes, and Teslas, are built on open source, and are fueled by AI and data ."
 The Raspberry Pi is a neat piece of hardware that has captured the hearts of a generation with ~15M devices sold . Given the popularity of Deep Learning and the Raspberry Pi Camera we thought it would be nice if we could detect any object using Deep Learning on the Pi .
" In December 2017, a user named “DeepFakes’s” posted realistic looking explicit videos of famous celebrities on Reddit . He generated these fake videos using deep learning, the latest in AI, to insert celebrities’ faces into adult movies . DeepFakes offers the ability to swap one face for another in an image or a video ."
" CapsNet is a neural network that uses capsule networks to solve problems of neural networks . The architecture is designed to solve some of the traditional problems of convolutional networks . I’ll go through it layer by layer, with as much detail as I can possibly conjure up . In order to make it easier to follow along, I have built a visualization tool ."
" Last year I set a goal to learn something new each month and ended out launching six new projects . It seems crazy to me that I managed to launch as much as I did while running a (more than) full time business, teaching as an adjunct professor, and consulting on the side ."
" At Mobile World Congress 2017, chatbots were the main headliners . The only significant question was who would monopolize the field, not whether chatbots would take off in the first place . Because there isn’t even an ecosystem for a platform to dominate, we have an answer to that question ."
" When we were small we did everything together, and Jane was, in that her birth parents were, for the most part, out of the picture . We also both liked fantasy books and hated afterschool, but that’s where the similarities ended . I wonder a lot about how Jane ended up ."
" M.L. is a new language for machine learning and neural networks . The language has been used in some of the world’s most complex systems, such as machine learning, but it can be hard to understand . Here is a look at how to use the language in a new way of thinking about language ."
 2018 is an exciting time for students of machine learning . Coursera’s Machine Learning course is the “OG” machine learning course . Udacity's Machine Learning Engineer Nanodegree program is very different in nature . If you don’t have time to take both then hopefully this post can help you decide which one is best for you .
 Semantic segmentation is one of the key problems in the field of computer vision . Increasing number of applications nourish from inferring knowledge from imagery . Many semantic segmentation problems are being tackled using deep learning . This article is a comprehensive overview including a step-by-step guide to implement a deep learning image segmentation model .
 The Raspberry Pi is a neat piece of hardware that has captured the hearts of a generation with ~15M devices sold . Given the popularity of Deep Learning and the Raspberry Pi Camera we thought it would be nice if we could detect any object using Deep Learning on the Pi .
" We have all been there. You have a stellar concept that can be implemented using a machine learning model . Chances are, you find a dataset that has around a few hundred images . You also recall someone mentioning having a large dataset is crucial for good performance . Our optimization goal is to chase that sweet spot where our model’s loss is low ."
" Significant breakthroughs in AI technology have been achieved through modeling human systems . In image recognition and processing, the inspiration from the complex and more spatially invariant cells of the visual system in CNNs has also produced great improvements to our technologies . If you’re interested in applying image recognition technologies on audio spectrograms, check out my article “What’s wrong with CNNs and spectrogram for audio processing?”"
 Neural networks are capable of learning output functions that can change wildly with small changes in input . Adding noise to inputs randomly is like telling the network to not change the output in a ball around your exact input . In this post we’ll see some examples where the noise can be used as an advantage .
" Deep learning models have a massive number of parameters that are not optimized inherently in the model . Building on the design and architecture of the experts who have done deep research in your domain is the best way to improve your models . If you have tricks you’ve found impactful, please share them with us ."
" For this tutorial in my Reinforcement Learning series, we are going to be exploring a family of RL algorithms called Q-Learning algorithms . These are a little different than the policy-based algorithms that will be looked at in the the following tutorials (Parts 1–3) Instead of starting with a complex and unwieldy deep neural network, we will begin by implementing a simple lookup-table version of the algorithm ."
 The Activation functions can be basically divided into two types- the line or linear . The Nonlinear Activation Functions are the most used activation functions . The nonlinear functions are mainly divided on the basis of their range or curves- the Sigmoid or Logistic Activation Function curve looks like a S-shape .
 A natural extension from Principle Component Analysis pooling layer would be making a full neural network out of the layer . I wanted to know if this was even possible as well as how well or worse it performs on MNIST data . The basic idea is Pooling layers such as Max or Mean pooling operations perform dimensionality reduction .
 There is in total of 5 different case of RNN I wish to implement . In order to fully understand all of the implementations it would be a good idea to have a strong understanding of vanilla RNN . If anyone wishes to review simple simple RNN please visit my old blog post “Only Numpy: Vanilla Recurrent Neural Network Deriving Back propagation Through Time Practice .
" Wallarm AI engine is the heart of our security solution . Many of our machine learning algorithms are written on top of TensorFlow, an open-source dataflow software library originally release by Google . We are always looking for ways to speed things up in software . Our latest find is Dataset API which makes working with data faster ."
" Norman is a member of the popular Reddit community . He has written a series of posts on the social networking site Reddit . The posts include a post titled, “Norman’s” and “P.E. Norman” The post was published on November 4, 2013 ."
 Neural networks are capable of learning output functions that can change wildly with small changes in input . Adding noise to inputs randomly is like telling the network to not change the output in a ball around your exact input . In this post we’ll see some examples where the noise can be used as an advantage .
 Backpropagation is a method used in artificial neural networks to calculate a gradient that is needed in the calculation of the weights to be used in the network . It is commonly used by the gradient descent optimization algorithm to adjust the weight of neurons by calculating the gradient of the loss function .
" For this tutorial in my Reinforcement Learning series, we are going to be exploring a family of RL algorithms called Q-Learning algorithms . These are a little different than the policy-based algorithms that will be looked at in the the following tutorials (Parts 1–3) Instead of starting with a complex and unwieldy deep neural network, we will begin by implementing a simple lookup-table version of the algorithm ."
" This is the most complete list and the Big-O is at the very end, enjoy . This is a free software machine learning library for the Python programming language . It features various classification, regression and clustering algorithms including support vector machines, random forests, gradient boosting and DBSCAN . The flowchart will help you check the documentation and rough guide of each estimator ."
 Backpropagation is a leaky abstraction . It is easy to fall into the trap of abstracting away the learnin process . Backpagation can be a useful tool for deep learning algorithms . The problem is that it is not easy to abstract away from learning in this way .
" This article assumes that you have a basic knowledge of an artificial “neuron” I would recommend reading up on the basics of neural networks before reading this article for better understanding . An artificial neuron calculates a “weighted sum” of its input, adds a bias and then decides whether it should be “fired” or not ."
" This will be my final post for the year, and I hope it will serve as a culmination of all the previous topics in the series . In this article I provide a tutorial on implementing the Asynchronous Advantage Actor-Critic (A3C) algorithm in Tensorflow . We will use it to solve a simple challenge in a 3D Doom environment ."
" A neural network is a type of artificial intelligence that learns the structure of text . It’s powerful enough to string together words in a way that seems almost human . The other 10% is all wackiness, but I was not disappointed . I even photoshopped some of my favorites into existence ."
" Success with Deep Learning heavily depends on having the right hardware to work with . When I was building my personal Deep Learning box, I reviewed all the GPUs on the market . In this article, I’m going to share my insights about choosing the right graphics processor . Also, we’ll go over: Deep Learning is part of the field of Machine Learning ."
" At Datafiniti, we have a strong need for converting unstructured web content into structured data . The real challenge is that if we look at the entire set of possible web pages, those similarities and differences become somewhat blurred, which means hard and fast rules for classifications will fail often ."
 Google’s word2vec is a neural network language model that is “both supervised and unsupervised” It’�s a neural net language model ‘both supervised’ and ‘unsupervised .’ Word vectors generated by the neural net have nice semantic and syntactic behaviors .
" In my last blog post, I learned how to build a neural network for the first time . It was super simple. 9 lines of Python code modelling the behaviour of a single neuron . But what if we are faced with a more difficult problem? Can you guess what the ‘?’ should be?"
" The year 2015 was a monumental year in the field of artificial intelligence . We have programs that can tell stories about pictures and cars that are driving themselves . With AI technology becoming the core of just about everything we do, we think it’s important to understand some of the common terminology and get a rough idea of how it all works ."
" Ray Kurzweil’s book How to Create a Mind: The secret of human thought revealed . He argues that the algorithm may be simpler than we would expect and that it will be based on the Pattern Recognition Theory of the Mind . The human brain is the most incredible thing in the known universe . However, it also has limitations and this gives us clues as to how it works ."
" ModelZoo is only supported in Caffe . Keras, Theano, and Caffe kernels are different kernels for Keras and Theano . After reading this blog, you’ll be able to load models from modelZoo into any of your favorite Python tools ."
" Could you go into more detail about finding the error on layer 1? That’s a really great question! I’ve changed this response quite a bit as I wrote it, because your question helped me improve my understanding . It sounds like you know quite a lot about neural networks already, however I'm going to explain everything fully for readers ."
" A self-teaching algorithm learns to play Super Mario Bros. for the Nintendo Entertainment System (NES) It begins with absolutely no knowledge of what Mario is, how to play it, or what winning looks like . Using neuroevolution, the algorithm slowly builds up a foundation for itself to progress in the game ."
" SwiftKey has introduced artificial neural networks into its smartphone keyboard for the first time . The technology will help define the smartphone experience of the future . SwiftKey is a British tech company that co-founded in 2009 with the help of Alan Turing, the father of the field of artificial intelligence ."
