" After years of using thin MacBooks, I had gotten used to using Amazon P2 servers . As time passed, the bills steadily grew larger, even as I switched to 10x cheaper Spot . Eventually the model complexity grew and took longer to train . Nudged by the great experiences of the other folks on the Fast.AI Forum, I decided to get into Deep Learning ."
" I originally wrote and published a version of this article in September 2016 . Since then, quite a bit has happened, further cementing my view that these changes are coming . Uber just announced that it just ordered 24,000 self-driving Volvos . Tesla just released an electric, long-haul tractor trailer with extraordinary technical specs ."
" A study claiming that artificial intelligence can infer sexual orientation from facial images caused a media uproar in the Fall of 2017 . The Economist featured this work on the cover of their September 9th magazine . Two major LGBTQ organizations, The Human Rights Campaign and GLAAD, immediately labeled it “junk science”"
" Most of us react to technological shifts with unease at best, panic at worst . But remarkably, most of what we worry about ends up never happeni . People feared getting replaced by technology. Maybe that is true of any change at all, maybe that's not true ."
" Google, Amazon, Microsoft and IBM are in a heavyweight fight investing over $20 billion in AI in 2016 . Corporates are scrambling to ensure they realise the productivity benefits of AI ahead of their competitors . China is putting its considerable weight behind AI and the European Union is talking about a $22 billion AI investment ."
" This is about AlphaGo, Google DeepMind’s Go playing AI that shook the technology world in 2016 by defeating one of the best players in the world, Lee Sedol . This week (March 8–15) marks the two-year anniversary of the AlphaGo vs Sedol match!"
" Google’s still experimental AI system, Duplex, launched at Google I/O, Google's annual developer conference . CEO Sundar Pichai explained that what we were hearing was a real phone call made to a hair salon that didn't know it was part of an experiment or that they were talking to a computer ."
" If your understanding of A.I. and Machine Learning is a big question mark, this is the blog post for you . Here, I gradually increase your AwesomenessicityTM by gluing inspirational videos together with friendly text . These videos take time, and if they don't inspire you to continue to the next section, fair enough ."
" In this post, I give an overview of the inner workings of Deep Reinforcement Learning (Deep RL) The inner workings and applications of Deep RL, such as AlphaGo, can often seem esoteric and hard to understand . The Insight AI Fellows Program invites companies working in AI to learn about applied Artificial Intelligence from Silicon Valley, New York, or Toronto ."
" The advent of powerful and versatile deep learning frameworks in recent years has made it possible to implement convolution layers into a deep learning model an extremely simple task, often achievable in a single line of code . In this post, we’ll break down the mechanics of the convolution operation, step-by-step, and relate it to the standard fully connected network . They build up a strong visual hierarchy, making them powerful feature extractors for images ."
" Information theory is an important field that has made significant contribution to deep learning and AI . Information theory can be seen as a sophisticated amalgamation of basic building blocks of deep learning: calculus, probability and statistics . Some examples of concepts in AI that come from Information theory or related fields:"
" Over the past 8 months, I’ve been interviewing at various companies like Google’s DeepMind, Wadhwani Institute of AI, Microsoft, Ola, Fractal Analytics, and a few others primarily for the roles — Data Scientist, Software Engineer & Research Engineer . In the process, I got an opportunity to interact with many great minds, but also had a peek at myself along with a sense of what people really look for when interviewing someone ."
" Drones and it’s associated functions are set to be a $50 billion industry by 2023 . Currently drones being used in domains such as agriculture, construction, public safety and security to name a few and are rapidly being adopted by others . With deep-learning based computer vision now powering these drones, industry experts are predicting unprecedented use in previously unimaginable or infeasible applications ."
 This article is an attempt to understand the inner workings of a neural network . It is the first time I’ve written this article in the open-source version of TensorFlow . It’s a simple example of a 2-layer neural network that maps a given input to a desired output .
" A code tutorial in Tensorflow that uses Reinforcement Learning to take free kicks . In previous article, I presented an AI bot trained to play the game of FIFA using Supervised Learning . With this approach, the bot quickly learnt the basics of the game like passing and shooting . However, the training data required to improve it further quickly became cumbersome to gather and provided little-to-no improvements . For this sake, I decided to switch to Reinversive Learning, as suggested by almost everyone who commented on that article!"
" For Deep Learning & Machine Learning engineers out of all the probabilistic models in the world, Gaussian distribution model simply stands out . Even when they don’t, the Gaussian gives the best model approximation for these processes . For example, the distribution of total distance covered in an random walk tends towards a Gaussian probability distribution ."
" Donald J. Trump has a unique way of speaking that is, well, so uniquely him . Machine-generated text looks and sounds like something Donald Trump might say . It was this unique style that interested me, and I set out to try and capture it using machine learning . To learn President Trump's style, I first had to gather sufficient examples of it ."
" Latent semantic analysis works on large-scale datasets to generate representations to discover the insights through natural language processing . There are different approaches to perform the latent semantic analysis at multiple levels such as document level, phrase level, and sentence level . Primarily semantic analysis can be summarized into lexical semantics and the study of combining individual words into paragraphs or sentences ."
 O Grupo de Estudo em Deep Learning de Brasília is planejando o próximo ciclo de encontros do grupo . O grupo deve iniciar-se a partir do meio de junho de 2018 . Ainda há tempo para manifestar suas preferéncias para participatear do gruco .
 Some of the greatest minds in artificial intelligence are working to develop programs that can create drawing and music independently from humans . The use of artificial intelligence in the field of art has even been picked up by tech giants the likes of Google . The projects that are included in this paper could have drastic implications in our everyday lives . They may also change the way we view art .
" This guide is for anyone who is curious about machine learning but has no idea where to start . The goal is be accessible to anyone — which means that there’s a lot of generalizations and we skip lots of details . If this gets anyone more interested in ML, then mission accomplished!"
 Facebook’s algorithms are able to recognize your friends’ faces after they have been tagged only a few times . Facebook can recognize faces with 98% accuracy which is pretty much as good as humans can do! But just recognizing your friends would be too easy. We can push this tech to the limit to solve a more challenging problem .
" For this tutorial in my Reinforcement Learning series, we are going to be exploring a family of RL algorithms called Q-Learning algorithms . These are a little different than the policy-based algorithms that will be looked at in the the following tutorials (Parts 1–3) Instead of starting with a complex and unwieldy deep neural network, we will begin by implementing a simple lookup-table version of the algorithm ."
" Convolutional Neural Networks(CNNs) have become the gold standard for image classification . At Athelas, we use CNNs for a lot more than just classification . In this post, we’ll see how CNNs can be used, with great results, in image instance segmentation ."
" For a hackathon that we did at STATWORX, some of our team members scraped minutely S&P 500 data from the Google Finance API . The data consisted of index as well as stock prices . The dataset I’ve used can be downloaded from here (40MB)"
" Geoffrey Hinton and his team published two papers that introduced a completely new type of neural network based on capsules . Hinton is one of the founders of deep learning and an inventor of numerous models and algorithms that are widely used today . The team published an algorithm, called dynamic routing between capsules, that allows to train such a network ."
" After years of using thin MacBooks, I had gotten used to using Amazon P2 servers . As time passed, the bills steadily grew larger, even as I switched to 10x cheaper Spot . Eventually the model complexity grew and took longer to train . Nudged by the great experiences of the other folks on the Fast.AI Forum, I decided to get into Deep Learning ."
" This is the most complete list and the Big-O is at the very end, enjoy . This is a free software machine learning library for the Python programming language . It features various classification, regression and clustering algorithms including support vector machines, random forests, gradient boosting and DBSCAN . The flowchart will help you check the documentation and rough guide of each estimator ."
" Netflix is constantly innovating by looking for better ways to find the best movies and TV shows for our members . When a new algorithmic technique such as Deep Learning shows promising results in other domains, it should not come as a surprise that we would try to figure out how to apply such techniques to improve our product ."
" When it comes to function minimization, it’s time to open a book of optimization and linear algebra . I am currently working on variable selection and lasso-based solutions in genetics . What lasso does is basically minimize the loss function and an penalty in order to set to zero some regression coefficients ."
" In my last blog post, I learned how to build a neural network for the first time . It was super simple. 9 lines of Python code modelling the behaviour of a single neuron . But what if we are faced with a more difficult problem? Can you guess what the ‘?’ should be?"
" The current documentation around loading a graph with C++ is sparse so I spent some time setting up a barebones example . In the TensorFlow repo there are more involved examples, such as building a graph in C++ . Many features (including automatic gradient computation) are not available from C++ yet ."
" Many examples on the Internet use matrices (grids of numbers) to represent a neural network . This method is favoured, but it is difficult to understand what is happening . The trick is to notice that the third column is irrelevant, but the first two columns exhibit the behaviour of a XOR gate ."
" We are currently living in the Era of Mobile, but we will move to the Age of Context in the next 5 years . Personal data (ex: calendar and email, location and time) is integrated with publicly available data . In the next five years personal data will be integrated with public and app-level data ."
" At this time, we are tracking 855 AI companies across 13 categories, with a combined funding amount of $8.75billion . The following companies utilize deep learning/machine learning technology in a specific way or use-case in their products . The six Artificial Intelligence visuals below help make sense of this dynamic market ."
" In Part 1 of this tutorial, I showed how to build a simple logistic regression model on Titanic dataset . In this part let’s go deeper and try multi-layer fully connected neural networks . Writing your custom model to plug into Scikit Flow and top it with trying out convolutional networks ."
" Awni Hannun presented on a new model that the Chinese search giant has developed for handling voice queries in Mandarin . The model is accurate 94 percent of the time in tests, Hannun says . It is based on a powerful deep learning system called Deep Speech that Baidu first unveiled in December 2014 ."
" An algorithm for rendering a photo in the style of a given painting has been created by deep convolutional neural networks since Google Research’s “DeepDream” post . On Sunday, Kai Sheng Tai posted the first public implementation of the algorithm on ArXiv . Unfortunately, his results don’t quite match the paper, and it's unclear why ."
" Highway networks, inspired by LSTMs, are a method of constructing networks with hundreds, even thousands of layers . Let’s see how we construct them using TensorFlow . For the highway layer what we want are two “gates” that control the flow of information . The “transform” gate controls how much of the activation we pass through ."
" My (expanded) talking points from a presentation I gave at the Re.Work Investing in Deep Learning dinner in London on 1st December 2015 . The pace of innovation can therefore only be accelerating . AI-driven products are already out in the market, and we don’t fully appreciate what tomorrow will look and feel like ."
" In the past few months I’ve been fascinated with “Deep Learning’s applications to language and text . I've spent the bulk of my career in financial technologies, mostly in algorithmic trading and alternative data services . I think that a decent indication of a clear thought is the ability to articulate it to people not from the field ."
 Backpropagation is a leaky abstraction . It is easy to fall into the trap of abstracting away the learnin process . Backpagation can be a useful tool for deep learning algorithms . The problem is that it is not easy to abstract away from learning in this way .
" In this tutorial I’ll explain how to build a simple working Recurrent Neural Network in TensorFlow . This is the first in a series of seven parts where various aspects and techniques of building Recurrent neural networks are covered . For now, let’s get started with the RNN!"
 The guide is mostly based on the work done by Denny Britz who has done a phenomenal job exploring the depths of Deep Learning for Bots . Code Snippets and Github included! Without further ado... Let us Begin! This guide is a condensed version of it -for length reasons .
" This will be my final post for the year, and I hope it will serve as a culmination of all the previous topics in the series . In this article I provide a tutorial on implementing the Asynchronous Advantage Actor-Critic (A3C) algorithm in Tensorflow . We will use it to solve a simple challenge in a 3D Doom environment ."
" This is first part of my experiments on application of deep learning to finance . In this, first part, I want to show how MLPs, CNNs and RNNs can be used for financial time series prediction . Let’s just consider historical dataset of S&P 500 index price movements ."
 In this tutorial we will be walking through the creation of a Deep Q-Network . It will be built upon the simple one layer Q-network we created in Part 0 . Google DeepMind team achieved superhuman performance on dozens of Atari games using their DQN agent .
" Part 1: The big picture of artificial intelligence and machine learning — past, present, and future . Part 2: Introducing linear regression, loss functions, overfitting, and gradient descent . Part 3: Unsupervised Learning. Clustering: k-means, hierarchical. Principal components analysis (PCA), singular value decomposition (SVD)"
" The HBO show Silicon Valley released a real AI app that identifies hotdogs . The app was developed in-house by the show, by a single developer, running on a single laptop & attached GPU . All AI work is powered 100% by the user’s device, and images are processed without ever leaving their phone ."
" Convolutional Neural Networks(CNNs) have become the gold standard for image classification . At Athelas, we use CNNs for a lot more than just classification . In this post, we’ll see how CNNs can be used, with great results, in image instance segmentation ."
" For a hackathon that we did at STATWORX, some of our team members scraped minutely S&P 500 data from the Google Finance API . The data consisted of index as well as stock prices . The dataset I’ve used can be downloaded from here (40MB)"
" Geoffrey Hinton and his team published two papers that introduced a completely new type of neural network based on capsules . Hinton is one of the founders of deep learning and an inventor of numerous models and algorithms that are widely used today . The team published an algorithm, called dynamic routing between capsules, that allows to train such a network ."
" After years of using thin MacBooks, I had gotten used to using Amazon P2 servers . As time passed, the bills steadily grew larger, even as I switched to 10x cheaper Spot . Eventually the model complexity grew and took longer to train . Nudged by the great experiences of the other folks on the Fast.AI Forum, I decided to get into Deep Learning ."
" This is the most complete list and the Big-O is at the very end, enjoy . This is a free software machine learning library for the Python programming language . It features various classification, regression and clustering algorithms including support vector machines, random forests, gradient boosting and DBSCAN . The flowchart will help you check the documentation and rough guide of each estimator ."
" In supervised learning problems, we start with a data set containing training examples with associated correct labels . For example, a supervised learning algorithm takes thousands of pictures of handwritten digits along with labels containing the correct number each image represents . The algorithm will then learn the relationship between the images and their associated numbers, and apply that learned relationship to classify completely new images ."
" Andrew Ng’s new deeplearning.ai course is like that Shane Carruth or Rajnikanth movie that one yearns for! It is both fun and useful! I have spent the past 4 evenings binge watching the lectures, working through quizzes and programming assignments ."
" A study claiming that artificial intelligence can infer sexual orientation from facial images caused a media uproar in the Fall of 2017 . The Economist featured this work on the cover of their September 9th magazine . Two major LGBTQ organizations, The Human Rights Campaign and GLAAD, immediately labeled it “junk science”"
" In March 2016, DeepMind’s AlphaGo beat 18 times world champion Go player Lee Sedol 4–1 in a series watched by over 200 million people . A machine had learnt a super-human strategy for playing Go, a feat previously thought impossible, or at least a decade away from being accomplished . On 18th October 2017, a new variant of the algorithm, AlphaGo Zero, that had defeated AlphaGo 100–0, had done so by learning solely through self-play ."
" This is about AlphaGo, Google DeepMind’s Go playing AI that shook the technology world in 2016 by defeating one of the best players in the world, Lee Sedol . This week (March 8–15) marks the two-year anniversary of the AlphaGo vs Sedol match!"
" We fell for Recurrent neural networks (RNN), Long-short term memory (LSTM), and all their variants . For a few years this was the way to solve sequence learning, sequence translation (seq2seq) and machine translation . Then in the following years (2015–16) came ResNet and Attention . One could then better understand that LSTM were a clever bypass technique ."
" In a recent article, I suggested that deep learning by itself was unlikely to lead on its own to artificial general intelligence . I suggested instead the deep learning be viewed “not as a universal solvent, but simply as one tool among many’s” I’ve compiled a list of four things I think is important to consider ."
" It is quite possible to learn, follow and contribute to state-of-art work in deep learning in about 6 months’ time . This article details out the steps to achieve that .Pre-requisites: You are willing to spend 10–20 hours per week for the next 6 months ."
" DeepMind’s AlphaGo Zero program beat the prior version of AlphaGo 100–0 . It was trained without any data from real human games . In this essay, I’ll try to give an intuitive idea of the techniques it used to play Go ."
" Chicisimo is an app that offers automated outfit advice . Over 4 million women have used the app since it was launched three years ago . The team built a system that learns fashion taste using data and machine learning . It’s been chaotic but it is now under control, says team ."
 The Raspberry Pi is a neat piece of hardware that has captured the hearts of a generation with ~15M devices sold . Given the popularity of Deep Learning and the Raspberry Pi Camera we thought it would be nice if we could detect any object using Deep Learning on the Pi .
" Within three years, deep learning will change front-end development . It will increase prototyping speed and lower the barrier for building software . In this post, we’ll teach a neural network how to code a basic a HTML and CSS website based on a picture of a design mockup ."
" If your understanding of A.I. and Machine Learning is a big question mark, this is the blog post for you . Here, I gradually increase your AwesomenessicityTM by gluing inspirational videos together with friendly text . These videos take time, and if they don't inspire you to continue to the next section, fair enough ."
" If you host a “Q-Node”, a node that supports the Q protocol (layer) you can earn rewards in these manners: Offering PoW (mining rigs, computer, or your coffee pot), PoS (your IOTA’s that you hold), bandwidth that you don’t use, and simply, the previous history of running an honest node for the system ."
" At its most simple, it’s the act of talking to your customers: their problems, their stories, their successes . Chatbots have become a mainstay of digital marketing, and every day their underlying AI becomes more sophisticated . Gartner predicts that by 2020, 30% of our interactions will be conversational ."
" This December I wrote a widely-circulated article on the inapplicability of blockchain to any actual problem . People objected mostly not to the technology argument, but rather hoped that decentralization could produce integrity . No matter how much blockchain improves it is still headed in the wrong direction ."
 The international beta of our brand new crypto saving app is coming soon . The beta app will be launched in English language and will exclusively be available for our ICO token buyers only . There are 3 simple steps to set up your wish in less than one minute: Name your wish and select one of our illustrations to always keep you motivated .
" There’s something for everyone on this list of Artificial Intelligence courses . Topics include: Building an AI that combines the power of Data Science, Machine Learning and Deep Learning to create powerful AI for Real-World applications . Learn the relationship between reinforcement learning and psychology and on a technical level ."
 The Raspberry Pi is a neat piece of hardware that has captured the hearts of a generation with ~15M devices sold . Given the popularity of Deep Learning and the Raspberry Pi Camera we thought it would be nice if we could detect any object using Deep Learning on the Pi .
" Latent semantic analysis works on large-scale datasets to generate representations to discover the insights through natural language processing . There are different approaches to perform the latent semantic analysis at multiple levels such as document level, phrase level, and sentence level . Primarily semantic analysis can be summarized into lexical semantics and the study of combining individual words into paragraphs or sentences ."
" After the euphoria for apps, the trend is reversing. Every day we download fewer new apps and we keep with few in constant use . The second social network used by Mexicans is WhatsApp a messaging app and the first, although the report has no separate data, is Facebook ."
" This December I wrote a widely-circulated article on the inapplicability of blockchain to any actual problem . People objected mostly not to the technology argument, but rather hoped that decentralization could produce integrity . No matter how much blockchain improves it is still headed in the wrong direction ."
" Convolutional Neural Networks(CNNs) have become the gold standard for image classification . At Athelas, we use CNNs for a lot more than just classification . In this post, we’ll see how CNNs can be used, with great results, in image instance segmentation ."
" After years of using thin MacBooks, I had gotten used to using Amazon P2 servers . As time passed, the bills steadily grew larger, even as I switched to 10x cheaper Spot . Eventually the model complexity grew and took longer to train . Nudged by the great experiences of the other folks on the Fast.AI Forum, I decided to get into Deep Learning ."
 Some software jobs are definitely going away but programmers with the right experience and knowledge will continue to be prestigious and well-paid . While it’s true that there is a great deal of “ridiculous industry jargon” there are equally many genuinely difficult problems waiting to be solved .
