" At Mobile World Congress 2017, chatbots were the main headliners . The only significant question was who would monopolize the field, not whether chatbots would take off in the first place . Because there isn’t even an ecosystem for a platform to dominate, we have an answer to that question ."
" We live in a world where there is a seemingly infinite amount of accessible, free resources looming just one search away at all times . When not managed effectively, an over-reliance on these resources can build poor habits that will set you back long-term . This approach is lazy and while it may be the path of least resistance, it will ultimately hurt your growth ."
" Machine learning is increasingly moving from hand-designed models to automatically optimized pipelines using tools such as H20, TPOT, and auto-sklearn . Feature engineering, also known as feature engineering, is the process of constructing new features from existing data to train a machine learning model ."
" If your understanding of A.I. and Machine Learning is a big question mark, this is the blog post for you . Here, I gradually increase your AwesomenessicityTM by gluing inspirational videos together with friendly text . These videos take time, and if they don't inspire you to continue to the next section, fair enough ."
" In this post, I give an overview of the inner workings of Deep Reinforcement Learning (Deep RL) The inner workings and applications of Deep RL, such as AlphaGo, can often seem esoteric and hard to understand . The Insight AI Fellows Program invites companies working in AI to learn about applied Artificial Intelligence from Silicon Valley, New York, or Toronto ."
" The advent of powerful and versatile deep learning frameworks in recent years has made it possible to implement convolution layers into a deep learning model an extremely simple task, often achievable in a single line of code . In this post, we’ll break down the mechanics of the convolution operation, step-by-step, and relate it to the standard fully connected network . They build up a strong visual hierarchy, making them powerful feature extractors for images ."
" Machine learning is a field of study that gives computers the ability to learn without being explicitly programmed . Only recently have we seen the most exciting applications of machine learning . Digital assistants, autonomous driving, and spam-free email all exist thanks to machine learning. Only in the past few years companies like Google, Amazon, and Apple  have used machine learning to develop software ."
" Data science interviews certainly aren’t easy . I’ve participated in over 50 individual interviews and phone screens while applying for competitive internships over the last year . Many of these resources are geared towards entry-level and intern data science positions, as that’s where my expertise lies ."
" Information theory is an important field that has made significant contribution to deep learning and AI . Information theory can be seen as a sophisticated amalgamation of basic building blocks of deep learning: calculus, probability and statistics . Some examples of concepts in AI that come from Information theory or related fields:"
" Over the past 8 months, I’ve been interviewing at various companies like Google’s DeepMind, Wadhwani Institute of AI, Microsoft, Ola, Fractal Analytics, and a few others primarily for the roles — Data Scientist, Software Engineer & Research Engineer . In the process, I got an opportunity to interact with many great minds, but also had a peek at myself along with a sense of what people really look for when interviewing someone ."
" Last year, I published the article “From Ballerina to AI writer” where I described how I embraced the technical part of AI without a technical background . But having love and passion for AI, I educated myself and was able to build a neural net classifier and do projects in Deep RL . Recently, I’ve become a participant in the OpenAI Scholarship Program ."
" Latent semantic analysis works on large-scale datasets to generate representations to discover the insights through natural language processing . There are different approaches to perform the latent semantic analysis at multiple levels such as document level, phrase level, and sentence level . Primarily semantic analysis can be summarized into lexical semantics and the study of combining individual words into paragraphs or sentences ."
" Scientists led by Enrico Fermi created the first self-sustaining nuclear reaction inside a pile of bricks and wood underneath a football field at the University of Chicago . Known to history as Chicago Pile-1, it was celebrated in silence with a single bottle of Chianti, for those who were there understood exactly what it meant for humankind ."
 This guide is for anyone who is curious about machine learning but has no idea where to start . The content of this article is now available as a full-length video course that walks you through every step of the code . You can take the course for free (and access everything else on Lynda.com free for 30 days) if you sign up with this link .
" This guide is for anyone who is curious about machine learning but has no idea where to start . The goal is be accessible to anyone — which means that there’s a lot of generalizations and we skip lots of details . If this gets anyone more interested in ML, then mission accomplished!"
 Facebook’s algorithms are able to recognize your friends’ faces after they have been tagged only a few times . Facebook can recognize faces with 98% accuracy which is pretty much as good as humans can do! But just recognizing your friends would be too easy. We can push this tech to the limit to solve a more challenging problem .
" In five days from July 24th to 28th 2017, I interviewed at LinkedIn, Salesforce Einstein, Google, Airbnb, and Facebook . It was a great experience, and I feel fortunate that my efforts paid off . I will discuss how I prepared, review the interview process, and share my impressions about the five companies ."
 Google published an article about machine learning in the closing weeks of 2016 . It may just be the most astonishing article I read last year . Disclaimer: I’m not an expert in neural networks or machine learning . I strongly encourage readers to browse the comments after reading the article for some perspectives more sober and informed .
" Machine Learning is using generic algorithms to tell you something interesting about your data without writing any code specific to the problem you are solving . We’ll build a neural network, feed it existing Super Mario levels and watch new ones pop out! This guide is for anyone who is curious about machine learning but has no idea where to start ."
" A year and a half ago, I dropped out of one of the best computer science programs in Canada . I realized that I could learn everything I needed through edX, Coursera, and Udacity instead . I've taken many data science-related courses and audited portions of many more . I started creating a review-driven guide that recommends the best courses for each subject within data science ."
" Artificial Intelligence (AI) is the mantra of the current era . The idea that our era is somehow seeing the emergence of an intelligence in silicon that rivals our own entertains all of us — enthralling us and frightening us in equal measure . There is a different narrative that one can tell about the . current era, which involves humans, computers, data and life-or-death decisions ."
" Real-world data tends to be incomplete, noisy, and inconsistent . Preprocessing is an important task when preprocessing the data is to fill in missing values . This is usually done when the class label is missing (assuming your data mining goal is classification), or many attributes are missing from the row ."
 VP of research Alfred Spector talks to Oliver Lindberg about the technologies emerging from Google Labs . Google has always been tight-lipped about products that haven’t launched yet . Spector is astounded by how rapidly it’s come along . Google Mobile App features 'search by voice' capabilities .
" Machine Learning is based on the language of Machine Learning . Machine Learning, Machine Learning and Machine Learning. It is based in California and has been used in millions of millions of times since 2008 . It has been dubbed ""Machine Learning"" by Machine Learning’s John Defterios ."
" In Part 1, we relate the Netflix Prize to the broader recommendation challenge . In Part 2, we will describe some of the data and models that we use and discuss our approach to algorithmic innovation . Remember that we are always looking for more star talent to add to our great team, so please take a look at our jobs page ."
" In part one of this blog post, we detailed the different components of Netflix personalization . We will discuss some of our current models, data, and approaches we follow to lead innovation and research in this space . The goal of recommender systems is to present a number of attractive items for a person to choose from . This is usually accomplished by selecting some items and sorting them in ."
" An improved SymSpell implementation is now 1,000,000x faster . Both algorithms are based on Edit distance (Damerau-Levenshtein distance) Both try to find the dictionary entries with smallest edit distance from the query term . If the edit distance is 0 the term is spelled correctly, if the editing distance is <=2 the dictionary term is used as spelling suggestion . But SymSpell uses a different way to search the dictionary, resulting in a significant performance gain ."
" This post outlines a formalization of what Nick Bostrom calls “indirect normativity” I don't think it’s an adequate solution to the AI control problem . To my knowledge it was the first precise specification of a goal that meets the “not terrible” bar, i.e. which does not lead to terrible consequences if pursued without any caveats or restrictions ."
 Computer scientists have been working to simulate the human capacity to feel and understand emotions . This paper explores what it means to live in an age where computers can have emotional depth . Investigating the human to computer relationship through reverse engineering the Turing test . Implications for this study are discussed and the direction for future research suggested .
 Xavier Amatriain and Justin Basilico build a software architecture that handles large volumes of existing data and is responsive to user interactions . The main components of the architecture contain one or more machine learning algorithms . We present an overall system diagram for recommendation systems in the following figure .
 Machine learning (ML) is a field of computer science where algorithms improve their performance at a certain task as more data are observed . Despite its many successes we are still learning what exactly can ML do for data practitioners . I gave a talk on this topic earlier this fall at Northwestern University and wanted to share these cautionary tales with a wider audience .
" At Datafiniti, we have a strong need for converting unstructured web content into structured data . The real challenge is that if we look at the entire set of possible web pages, those similarities and differences become somewhat blurred, which means hard and fast rules for classifications will fail often ."
" Sune Lehmann is an Associate Professor at DTU Informatics, Technical University of Denmark . His main research project has to do with measuring real social networks with high resolution . Lehmann has worked as a Postdoctoral Fellow at Harvard University and the Center for Cancer Systems Biology at the Dana Farber Cancer Institute ."
" The big question is, how can we compare every single message we see with every other message efficiently and accurately? In this article, we’ll be exploring a technique known as Multi-Index Locality Sensitive Hashing . To perform the the comparison efficiently, we pre-process the data with a series of steps ."
" In this picture, Pranav Mistry is using color marker on his fingers to track the gesture and his wearable computer perform action based on gestures . Computer need to understand those color marker first, for that it needs to separate marker from any surroundings .Segmentation can be helpful to achieve this. Various methods are available for segmentation, however, this article talks about robust Color based object segmentation ."
 Kaggle announced the Traveling santa problem in the christmas season . Solving this problem would require expertise on data structures and some good familiarity with TSP problems and its many heuristic algorithms . LKH easily solved my tsp problem in around 30 hours . I finished 65th out of 356 total competitors .
 This guide is for anyone who is curious about machine learning but has no idea where to start . The content of this article is now available as a full-length video course that walks you through every step of the code . You can take the course for free (and access everything else on Lynda.com free for 30 days) if you sign up with this link .
" Bloomberg Beta, which is focused on the future of work, has been investing in machine intelligence startups . Bloomberg Beta has a fund that invests in artificial intelligence, machine learning and data-related tech startups . I created this landscape to start to put startups into context . It's much easier to identify crowded areas and see white space once the landscape has some sort of taxonomy ."
" At Airbnb, we want to build the world’s most trusted community . The overwhelming majority of web users act in good faith, but unfortunately, there exists a small number of bad actors who attempt to profit by defrauding websites and their communities . Airbnb hosts trust that guests will treat their home with the same care and respect as their own ."
 Google’s word2vec is a neural network language model that is “both supervised and unsupervised” It’�s a neural net language model ‘both supervised’ and ‘unsupervised .’ Word vectors generated by the neural net have nice semantic and syntactic behaviors .
" Content is sourced from inputs such as people and boards the user follows, interests, and recommendations . Different sources of Pins should be mixed together at different rates . Some sources may produce Pins of poor quality for a user, so we can be selective about what to show and what to hold back for a future session ."
 The term data scientist has been used lately to describe a variety of skills & roles . In this post I will focus on a particular flavor of data scientist . I will talk about the qualities needed to be a good data scientist-engineer who ships relevance products to users . These folks need to be strong at data science and engineering to be successful .
" A very good data hacker can easily find themselves with a great idea at a hackathon but with little to nothing to demo at the end . This is a great characteristic to build into the plan of a hack but one that simply does not do so . Accepting that my personal experience is just my own, let me offer three tips for building new models ."
" Wolfram Alpha is a search engine that uses natural language to search vast sets of data and even compute math . Mathematica was designed as a desktop tool for computational research and exploration . It continued evolving and the breakthrough was realizing those symbols could be anything: images, images or words ."
" Andrew Ng’s Machine Learning class on Coursera is part of a series covering the exercises from the class . This content originally appeared on Curious Insight . The original code, exercise text, and data files for this post are available here . Part 8 of the series is anomaly Detection & Recommendation ."
" Pinterest is building a service that’s powered by people, and supercharged with technology . The core value of Pinterest is to help people find the things they care about, by connecting them to Pins and people that relate to their interests . The interest graph — the connections that make up the Pinterest index — creates bridges between Pins, boards, and Pinners . From categories like travel, fitness, and humor, we're building a visual discovery tool for all interests ."
" What Machine Learning Teaches Us About Ourselves? Follow me on Twitter to keep informed of interesting developments on these topics . The idea of quantum computing arose from attempts to simulate quantum mechanics on ordinary computers . Quantum computing is a technology intended to solve specific classes of problems, but it is not a solution to all problems ."
" Getting into machine learning (ml) can seem like an unachievable task from the outside . After dedicating one week to learning the basics of the subject, I found it to be much more accessible than I anticipated . This article is intended to give others interested in getting into ml a roadmap of how to get started ."
" Many tech companies now have teams of smart data-scientists versed in big-data infrastructure tools and machine learning algorithms . But every now and then, a data set with very few data points turns up and none of these algorithms seem to be working properly anymore . What can you do about it?"
" Data science and machine learning have long been interests of mine . I’ve listened to a bunch of machine learning and data science podcasts in the last few months . I'm working on Fuzzy.ai and trying to make AI accessible to all developers, I need to keep on top of all the news in both fields ."
 Google released a machine learning framework called TensorFlow and it’s taking the world by storm . The answer is two part: How you to use it for something regular problem Data Scientist may have? (and if you are AI researcher — we will build up to interesting problems over time).
 It’s very common for machine learning practitioners to have favorite algorithms . The performance of ML algorithms varies wildly depending on the application and the dimensionality of the dataset . My favorite out-of-the-box algorithm is (as you might have guessed) the Random Forest .
" The OTTO Group Kaggle competition was held by Xavier Conort in France . The French community as a whole has been very active . Here are a few things I learned from the competition . We heavily used stacking. We added to an initial set of 93 features, new features being the predictions of N different classifiers (Random Forest, GBM, Neural Networks, ...). And then retrained P classifiers over the 93 + N features . And finally made a weighted average of the P outputs ."
 Machine Learning    ‘’  คืออ ยินค  “” มก: ““ม’: ‘” “.”’ “?”? “   “ ” –   “ ” — “ค”:  ‘I’m a machine learning student.’ – “-” - “Machine Learning student”
" Machine-learning experiments are enabling us to generate stories based on the content of images . This experiment explores how to generate romantic stories about images (incl. guest star Taylor Swift) Neural-storyteller is a recently published experiment by Ryan Kiros (University of Toronto) It combines recurrent neural networks (RNN), skip-thoughts vectors and other techniques to generate little stories ."
" Guests reach out to hosts whose listings they wish to stay in, however a match succeeds only if the host also wants to accommodate the guest . Bar Ifrach was curious to discover what affects hosts’ decisions to accept requests and how Airbnb could increase acceptances and matches ."
" This guide is for anyone who is curious about machine learning but has no idea where to start . The goal is be accessible to anyone — which means that there’s a lot of generalizations and we skip lots of details . If this gets anyone more interested in ML, then mission accomplished!"
 Facebook’s algorithms are able to recognize your friends’ faces after they have been tagged only a few times . Facebook can recognize faces with 98% accuracy which is pretty much as good as humans can do! But just recognizing your friends would be too easy. We can push this tech to the limit to solve a more challenging problem .
" Machine Learning is using generic algorithms to tell you something interesting about your data without writing any code specific to the problem you are solving . We’ll build a neural network, feed it existing Super Mario levels and watch new ones pop out! This guide is for anyone who is curious about machine learning but has no idea where to start ."
" For this tutorial in my Reinforcement Learning series, we are going to be exploring a family of RL algorithms called Q-Learning algorithms . These are a little different than the policy-based algorithms that will be looked at in the the following tutorials (Parts 1–3) Instead of starting with a complex and unwieldy deep neural network, we will begin by implementing a simple lookup-table version of the algorithm ."
" For just $50, you can get an Amazon Echo Dot — a magic box that allows you to order pizza, get a weather report or even buy trash bags — just by speaking out loud . Deep learning has finally made speech recognition accurate enough to be useful outside of carefully controlled environments . Andrew Ng has long predicted that speech recognition will become a primary way that we interact ."
" The technology behind Google Translate is called Machine Translation . It has changed the world by allowing people to communicate when it wouldn’t otherwise be possible . Deep learning researchers are throwing together relatively simple machine learning solutions to machine translation . It turns out that over the past two years, deep learning has totally rewritten our approach to language translation ."
" In the past few months I’ve been fascinated with “Deep Learning’s applications to language and text . I've spent the bulk of my career in financial technologies, mostly in algorithmic trading and alternative data services . I think that a decent indication of a clear thought is the ability to articulate it to people not from the field ."
 Backpropagation is a leaky abstraction . It is easy to fall into the trap of abstracting away the learnin process . Backpagation can be a useful tool for deep learning algorithms . The problem is that it is not easy to abstract away from learning in this way .
 This is a follow up to an article I wrote about Machine Learning in a Week last year . I started learning about the subject on Hacker News in 2014 . My interest in ml stems back to 2014 when I started reading articles about it . I want to share my journey as it might inspire others to do the same .
" In five days from July 24th to 28th 2017, I interviewed at LinkedIn, Salesforce Einstein, Google, Airbnb, and Facebook . It was a great experience, and I feel fortunate that my efforts paid off . I will discuss how I prepared, review the interview process, and share my impressions about the five companies ."
 Google published an article about machine learning in the closing weeks of 2016 . It may just be the most astonishing article I read last year . Disclaimer: I’m not an expert in neural networks or machine learning . I strongly encourage readers to browse the comments after reading the article for some perspectives more sober and informed .
" A year and a half ago, I dropped out of one of the best computer science programs in Canada . I realized that I could learn everything I needed through edX, Coursera, and Udacity instead . I've taken many data science-related courses and audited portions of many more . I started creating a review-driven guide that recommends the best courses for each subject within data science ."
" Part 1: The big picture of artificial intelligence and machine learning — past, present, and future . Part 2: Introducing linear regression, loss functions, overfitting, and gradient descent . Part 3: Unsupervised Learning. Clustering: k-means, hierarchical. Principal components analysis (PCA), singular value decomposition (SVD)"
" The HBO show Silicon Valley released a real AI app that identifies hotdogs . The app was developed in-house by the show, by a single developer, running on a single laptop & attached GPU . All AI work is powered 100% by the user’s device, and images are processed without ever leaving their phone ."
" Spotify's Discover Weekly is a custom mixtape of 30 songs you've never listened to before but will probably love . The service has driven Spotify to rethink its approach to personalized music recommendations . It knows my musical tastes better than any person in my life ever has, and I'm consistently delighted by how satisfyingly just right it is every week ."
" Convolutional Neural Networks(CNNs) have become the gold standard for image classification . At Athelas, we use CNNs for a lot more than just classification . In this post, we’ll see how CNNs can be used, with great results, in image instance segmentation ."
" Neural networks are not just another classifier, they represent the beginning of a fundamental shift in how we write software . They are Software 2.0.0 . The “classical stack” of Software 1.0 is what we’re all familiar with . It consists of explicit instructions to the computer written by a programmer ."
" For a hackathon that we did at STATWORX, some of our team members scraped minutely S&P 500 data from the Google Finance API . The data consisted of index as well as stock prices . The dataset I’ve used can be downloaded from here (40MB)"
